[
  {
    "path": ".",
    "files": [],
    "exports": [],
    "imports": [],
    "approximate_imports": [],
    "dependents": [],
    "approximate_dependents": [],
    "entrypoints": [],
    "tests": [],
    "children": [
      "app",
      "scripts"
    ],
    "input_hash": "sha256:6e557c85a6af39035451b24e86e953b0c8b3218e0e12281f6c30f42be713c5ca"
  },
  {
    "path": "app",
    "files": [
      "__init__.py",
      "__main__.py",
      "config.py",
      "main.py",
      "test_config.py"
    ],
    "exports": [
      "DEBUG",
      "MAX_RETRIES",
      "Settings",
      "run"
    ],
    "imports": [
      "app/models",
      "app/services"
    ],
    "approximate_imports": [],
    "dependents": [
      "scripts"
    ],
    "approximate_dependents": [],
    "entrypoints": [
      "__main__.py"
    ],
    "tests": [
      "test_config.py"
    ],
    "children": [
      "app/models",
      "app/services"
    ],
    "input_hash": "sha256:adc99212e62040372b7fb0d57533215b4ccb861cdffddf095bae197b36275ca3"
  },
  {
    "path": "app/models",
    "files": [
      "__init__.py",
      "user.py"
    ],
    "exports": [],
    "imports": [
      "app/services"
    ],
    "approximate_imports": [],
    "dependents": [
      "app"
    ],
    "approximate_dependents": [],
    "entrypoints": [],
    "tests": [],
    "children": [],
    "input_hash": "sha256:70c3b7f7d1c4b04db23b9f553ae632c399451d2030263970932fb23be77476af"
  },
  {
    "path": "app/services",
    "files": [
      "billing.py"
    ],
    "exports": [
      "charge"
    ],
    "imports": [],
    "approximate_imports": [],
    "dependents": [
      "app",
      "app/models"
    ],
    "approximate_dependents": [],
    "entrypoints": [],
    "tests": [],
    "children": [],
    "input_hash": "sha256:7d474e5dd0bf6ad9923750cea62445fad66ffc8e1a88e09421525d011116c134"
  },
  {
    "path": "scripts",
    "files": [
      "helper.py",
      "run.py"
    ],
    "exports": [
      "assist"
    ],
    "imports": [
      "app"
    ],
    "approximate_imports": [],
    "dependents": [],
    "approximate_dependents": [
      "scripts/sub"
    ],
    "entrypoints": [
      "run.py"
    ],
    "tests": [],
    "children": [
      "scripts/sub"
    ],
    "input_hash": "sha256:556e44449d86d8e3b0a13449488fe47d01d5b1ad2842e6668bf74fc33986fa77"
  },
  {
    "path": "scripts/sub",
    "files": [
      "tool.py"
    ],
    "exports": [],
    "imports": [],
    "approximate_imports": [
      "scripts"
    ],
    "dependents": [],
    "approximate_dependents": [],
    "entrypoints": [],
    "tests": [],
    "children": [],
    "input_hash": "sha256:9dca263e25559bd1167ec2ec2b8d6d32af1327fc526a0877493d5e85a0c9614a"
  }
]
